18:06:06.702386 IP 165.227.33.165.ssh > 198.96.87.225.65182: Flags [P.], seq 1747993139:1747993247, ack 348831610, win 501, length 108
18:06:06.702468 IP 165.227.33.165.ssh > 198.96.87.225.65182: Flags [P.], seq 108:144, ack 1, win 501, length 36
18:06:06.702526 IP 165.227.33.165.ssh > 198.96.87.225.65182: Flags [P.], seq 144:196, ack 1, win 501, length 52
18:06:06.702968 IP 165.227.33.165.ssh > 198.96.87.225.65182: Flags [P.], seq 196:264, ack 1, win 501, length 68
18:06:06.703035 IP 165.227.33.165.ssh > 198.96.87.225.65182: Flags [P.], seq 264:332, ack 1, win 501, length 68
18:06:06.703085 IP 165.227.33.165.ssh > 198.96.87.225.65182: Flags [P.], seq 332:368, ack 1, win 501, length 36
18:06:06.707667 IP 198.96.87.225.65182 > 165.227.33.165.ssh: Flags [.], ack 368, win 255, length 0
18:06:11.075612 IP 206.168.34.164.38241 > 165.227.33.165.788: Flags [S], seq 2755772430, win 42340, options [mss 1460,sackOK,TS val 1737690353 ecr 0,nop,wscale 10], length 0
18:06:16.796991 IP 89.248.165.82.56748 > 165.227.33.165.30000: Flags [S], seq 4055091217, win 1024, length 0
18:06:17.020927 IP 104.234.115.35.21606 > 165.227.33.165.1122: Flags [S], seq 922921216, win 1024, options [mss 1460], length 0

